url,title,ingredients,cooking_time,nutrition_facts,publish_date,scraped_date,category
https://www.thespruceeats.com/dutch-baby-recipe-7092386,Classic Dutch Baby,grams milk; large eggs; teaspoon salt; grams all-purpose flour; tablespoons unsalted butter; powdered sugar; lemon wedges,30 min,Calories: 453; Fat: 19g; Carb: 68g; Protein: 16g,8/23/2023,2025-04-04,american_food
https://www.thespruceeats.com/big-cluster-pumpkin-spice-granola-recipe-6666497,Big Cluster Pumpkin Spice Granola,cups old fashioned oats; cup pecans; cup pepitas; cup quinoa; teaspoons pumpkin pie spice; teaspoon salt; cup pumpkin puree; cup maple syrup; cup honey; tablespoons olive oil; teaspoon vanilla extract; cup raisins,90 min,Calories: 149; Fat: 6g; Carb: 23g; Protein: 3g,10/4/2022,2025-04-04,breakfast_and_brunch
https://www.thespruceeats.com/scrapple-recipe-5215345,Scrapple Recipe,pounds boneless pork butt; pounds bone-in pork; large onion; bulb garlic; large dried bay leaves; tablespoons black peppercorns; teaspoons fine salt; large fresh sage leaves; sprigs fresh thyme; teaspoon dried oregano; cup cornmeal; teaspoon ground black pepper; tablespoons vegetable oil; cup all-purpose flour,7 hr 20 min,Calories: 646; Fat: 47g; Carb: 10g; Protein: 43g,1/25/2023,2025-04-04,american_food
https://www.thespruceeats.com/huevos-divorciados-recipe-5214077,Huevos Divorciados Recipe,pound tomatillos; cup white onion; clove garlic; jalapeño pepper; cup water; cup cilantro; kosher salt; dried guajillo pepper; pound tomatoes; cup white onion; clove garlic; cup water; tablespoon vegetable oil; large eggs; red onion; avocado; tablespoons cotija cheese; corn tortillas,60 min,Calories: 355; Fat: 19g; Carb: 32g; Protein: 18g,2/2/2022,2025-04-04,breakfast_and_brunch
https://www.thespruceeats.com/eggs-over-easy-4797537,Eggs Over Easy,teaspoons  unsalted butter; large egg; kosher salt; to taste; freshly ground black pepper; to taste,6 min,Calories: 156; Fat: 14g; Carb: 1g; Protein: 6g,12/26/2022,2025-04-04,breakfast_and_brunch
https://www.thespruceeats.com/sheet-pan-french-toast-recipe-5206278,Sheet Pan French Toast,large eggs; cup milk; tablespoon sugar; dash salt; teaspoon vanilla extract; teaspoon cinnamon; tablespoon butter; to 9 slices bread,33 min,Calories: 321; Fat: 11g; Carb: 41g; Protein: 15g,2/5/2023,2025-04-04,easter
https://www.thespruceeats.com/copycat-brown-sugar-oat-milk-shaken-espresso-5181222,Copycat Brown Sugar Oat Milk Shaken Espresso,ounce espresso; tablespoon brown sugar; teaspoon ground cinnamon; cups ice; cup oat milk,3 min,Calories: 177; Fat: 1g; Carb: 41g; Protein: 2g,7/9/2021,2025-04-04,breakfast_and_brunch
https://www.thespruceeats.com/shakshuka-recipe-5212033,Shakshuka Recipe,tablespoons olive oil; medium yellow onion; diced; mediumr r ed bell pepper; diced; cloves garlic; minced; to 2 tablespoons harissa paste; optional; teaspoons smoked or sweet paprika; teaspoon ground cumin; teaspoon ground coriander; can whole peeled tomatoes; salt; to taste; freshly ground black pepper; to taste; large eggs; cup crumbled feta cheese; cup fresh parsley or cilantro leaves,40 min,Calories: 155; Fat: 10g; Carb: 10g; Protein: 8g,1/17/2022,2025-04-04,african_food
https://www.thespruceeats.com/easy-oven-egg-bite-recipe-5214233,Easy Oven Egg Bite Recipe,cooking spray; large eggs; cup shredded cheddar cheese; cup half-and-half; teaspoon salt; dash pepper; pinch nutmeg; cup diced tomatoes; cup baby spinach; cup green onions,28 min,Calories: 134; Fat: 10g; Carb: 2g; Protein: 10g,12/21/2022,2025-04-04,breakfast_and_brunch
https://www.thespruceeats.com/crockpot-french-toast-recipe-5195049,Crockpot French Toast,ounce) french bread; cups milk; large eggs; cup light brown sugar; teaspoons vanilla extract; teaspoon ground cinnamon; teaspoon salt; tablespoons unsalted butter; cup confectioners' sugar; tablespoons maple syrup,2 hr 42 min,Calories: 328; Fat: 10g; Carb: 45g; Protein: 13g,2/7/2023,2025-04-04,breakfast_and_brunch
https://www.thespruceeats.com/steel-cut-overnight-oats-5101641,Steel Cut Overnight Oats,tablespoon butter; cup steel cut oats; teaspoon salt; cups water; cup milk; tablespoons brown sugar; cup plain yogurt; large grapefruit; tablespoon honey; to 2 tablespoons shelled pistachios,8 hr 20 min,Calories: 229; Fat: 7g; Carb: 35g; Protein: 7g,2/14/2025,2025-04-04,breakfast_and_brunch
https://www.thespruceeats.com/granola-recipe-4796424,Mix and Match Granola,cups rolled oats; cups nuts; cup raw seeds; cup coconut flakes; cup honey; cup oil; teaspoon salt; teaspoon vanilla extract; teaspoon ground cinnamon; cup  dried fruit,65 min,Calories: 573; Fat: 32g; Carb: 66g; Protein: 11g,1/3/2023,2025-04-04,breakfast_and_brunch
https://www.thespruceeats.com/sunny-side-up-eggs-4797347,Sunny-Side Up Eggs Recipe,teaspoons olive oil; large eggs; kosher salt; freshly ground black pepper,4 min,Calories: 153; Fat: 14g; Carb: 1g; Protein: 6g,12/26/2022,2025-04-04,breakfast_and_brunch
https://www.thespruceeats.com/cilbir-turkish-eggs-recipe-6823231,Çilbir (Turkish Eggs),cup plain greek yogurt; clove garlic; teaspoon lemon zest; teaspoons lemon juice; tablespoons dill; teaspoon salt; teaspoon ground black pepper; ounces unsalted butter; tablespoon chili pepper; teaspoon ground cumin; tablespoon white vinegar; large eggs; herbs; sea salt,27 min,Calories: 905; Fat: 57g; Carb: 62g; Protein: 36g,12/1/2022,2025-04-04,breakfast_and_brunch
https://www.thespruceeats.com/japanese-pancakes-4774572,Japanese Soufflé Pancakes,large egg whites; teaspoon lemon juice; teaspoon salt; tablespoons sugar; large egg yolks; teaspoons vanilla extract; cup whole milk; room temperature; tablespoons salted butter; melted; tablespoons cake flour; teaspoon baking powder,55 min,Calories: 253; Fat: 10g; Carb: 31g; Protein: 9g,5/11/2023,2025-04-04,easter
https://www.thespruceeats.com/instant-pot-lemon-curd-recipe-5209207,Instant Pot Lemon Curd Recipe,large eggs; large  egg yolks; cups granulated sugar; teaspoons lemon zest; cup lemon juice; teaspoon salt; tablespoons unsalted butter,4 hr 48 min,Calories: 182; Fat: 10g; Carb: 20g; Protein: 4g,2/28/2022,2025-04-04,breakfast_and_brunch
https://www.thespruceeats.com/blintz-souffle-dairy-2121454,Easy Blintz Soufflé,ounces unsalted butter; cheese blintzes; large eggs; cups sour cream; cup granulated sugar; teaspoons pure vanilla extract; cup orange juice; teaspoon ground cinnamon,55 min,Calories: 357; Fat: 24g; Carb: 22g; Protein: 12g,10/5/2023,2025-04-04,breakfast_and_brunch
https://www.thespruceeats.com/sourdough-french-toast-recipe-5196669,Sourdough French Toast,large eggs; cup heavy cream; tablespoons sugar; teaspoons vanilla extract; teaspoon ground cinnamon; teaspoon nutmeg; teaspoon salt; slices sourdough bread; cup butter; berries; maple syrup,62 min,Calories: 384; Fat: 20g; Carb: 39g; Protein: 11g,2/5/2023,2025-04-04,breakfast_and_brunch
https://www.thespruceeats.com/avocado-toast-4174244,The Ultimate Avocado Toast,slices multigrain toast; avocado; teaspoon lemon juice; teaspoon olive oil; to 1/4 teaspoon red pepper flakes; to 1/4 teaspoon sea salt,4 min,Calories: 419; Fat: 33g; Carb: 30g; Protein: 8g,7/7/2023,2025-04-04,fruit_veggie
https://www.thespruceeats.com/shiitake-bacon-5180678,Shiitake Bacon,cups shiitake mushrooms; teaspoon canola oil; teaspoons soy sauce; teaspoons maple syrup; teaspoon liquid smoke; teaspoon crushed red pepper flakes,30 min,Calories: 28; Fat: 1g; Carb: 5g; Protein: 1g,1/13/2024,2025-04-04,breakfast_and_brunch
https://www.thespruceeats.com/denver-omelet-4160677,Denver Omelet Recipe,teaspoon canola oil; cup white onion; cup green bell pepper; cup  canadian bacon; kosher salt; to taste; freshly ground black pepper; to taste; tablespoon butter; large eggs; cup cheddar cheese; salsa or hot sauce for serving,20 min,Calories: 402; Fat: 28g; Carb: 7g; Protein: 30g,1/4/2023,2025-04-04,breakfast_and_brunch
https://www.thespruceeats.com/basic-french-toast-3056820,Easy Homemade French Toast,large eggs; cup milk; dash salt; teaspoon sugar; tablespoons butter; to 10 slices bread,10 min,Calories: 366; Fat: 15g; Carb: 42g; Protein: 15g,9/15/2024,2025-04-04,easter
https://www.thespruceeats.com/peanut-butter-banana-bread-recipe-5204257,Peanut Butter Banana Bread,cooking spray; cups all-purpose flour; teaspoon baking soda; teaspoon baking powder; teaspoon salt; medium ripe ripe bananas; cup whole milk; cup coconut oil; large egg; cup brown sugar; cup granulated sugar; teaspoons pure vanilla extract; cup creamy peanut butter,65 min,Calories: 424; Fat: 18g; Carb: 59g; Protein: 8g,2/15/2022,2025-04-04,breads
https://www.thespruceeats.com/stuffed-french-toast-recipe-5206258,Stuffed French Toast,slices brioche; ounces cream cheese; cup milk; tablespoons sugar; teaspoons vanilla extract; large eggs; teaspoon kosher salt; teaspoon cinnamon or cardamom; tablespoons butter; fresh berries,30 min,Calories: 510; Fat: 32g; Carb: 42g; Protein: 14g,1/19/2023,2025-04-04,breakfast_and_brunch
https://www.thespruceeats.com/sous-vide-egg-bites-5101210,Sous Vide Egg Bites,slices bacon; large eggs; cup grated gruyere cheese; cup heavy cream; tablespoons cream cheese; teaspoon salt; teaspoon ground black pepper; fresh chives,75 min,Calories: 187; Fat: 15g; Carb: 1g; Protein: 12g,9/22/2023,2025-04-04,breakfast_and_brunch
https://www.thespruceeats.com/basic-chilaquiles-recipe-2342627,Chilaquiles Rojas With Fried Eggs,guajillo chiles guajillo chiles; chiles de árbol chiles de árbol; roma tomatoes roma tomatoes; garlic cloves garlic cloves; teaspoon chicken bouillon; teaspoon dried oregano; teaspoon salt; cup vegetable oil; tortilla corn tortillas; fried eggs fried eggs; cup roughly chopped cilantro; cup queso fresco; avocado avocado,50 min,Calories: 878; Fat: 75g; Carb: 48g; Protein: 10g,8/10/2024,2025-04-04,breakfast_and_brunch
https://www.thespruceeats.com/moroccan-harcha-semolina-pan-fried-flatread-2394807,Moroccan Harcha Semolina Pan-Fried Flatbread,cups fine semolina; tablespoons sugar; teaspoons baking powder; teaspoon salt; cup unsalted butter; to 3/4 cup milk; cup coarse semolina,40 min,Calories: 282; Fat: 12g; Carb: 37g; Protein: 6g,7/21/2021,2025-04-04,african_food
https://www.thespruceeats.com/spicy-morocccan-rice-with-tomatoes-peppers-2394883,Spicy Moroccan Rice with Tomatoes and Peppers,cup long-grain rice; tablespoons olive oil; medium onion; green pepper; yellow pepper; red pepper; cloves garlic; large tomato; large tomato; cups chicken broth; to 2 tablespoons tomato paste; to 3 tablespoons parsley; teaspoon salt; teaspoon ground cumin; teaspoon paprika; teaspoon cayenne pepper; teaspoon pepper; teaspoon; pinch saffron; stick cinnamon stick,50 min,Calories: 191; Fat: 8g; Carb: 28g; Protein: 5g,9/22/2021,2025-04-04,african_food
https://www.thespruceeats.com/moroccan-avocado-milkshake-smoothie-2394946,Moroccan Avocado Smoothie,avocado; tablespoons sugar; to 3 cups cold milk; handful ice,5 min,Calories: 385; Fat: 24g; Carb: 36g; Protein: 11g,9/7/2022,2025-04-04,african_food
https://www.thespruceeats.com/mrouzia-lamb-tagine-with-raisins-almonds-2394654,"Moroccan Lamb Tagine With Raisins, Almonds, and Honey",lamb; teaspoons ras el hanout; teaspoons ground ginger; teaspoons salt; teaspoon pepper; teaspoon turmeric; teaspoon saffron threads; medium onions; cloves garlic; cup unsalted butter; small cinnamon sticks; cups water; cups sultana raisins; cup honey; teaspoon ground cinnamon; cup almonds,105 min,Calories: 730; Fat: 34g; Carb: 62g; Protein: 50g,5/25/2021,2025-04-04,african_food
https://www.thespruceeats.com/kefta-kebab-recipe-moroccan-ground-beef-2394668,Moroccan Kefta Kebab,pound ground beef; ounces ground beef; medium onion; teaspoons paprika; teaspoon cumin; teaspoon salt; teaspoon pepper; teaspoon cayenne pepper; cup fresh parsley; cup fresh cilantro; teaspoon ground cinnamon; tablespoon mint leaves,90 min,Calories: 326; Fat: 20g; Carb: 4g; Protein: 31g,9/27/2024,2025-04-04,african_food
https://www.thespruceeats.com/nigerian-jollof-rice-5176650,Nigerian Jollof Rice With Beef,medium plum; medium red bell pepper; small red onions; scotch bonnet pepper; cups vegetable stock; ounces stewing beef; teaspoons curry powder; teaspoons dried thyme; salt to taste; ground black pepper to taste; cup oil; small to medium dried bay leaves; tablespoons tomato paste; teaspoons unsalted butter; cups long-grain rice,90 min,Calories: 300; Fat: 14g; Carb: 25g; Protein: 19g,3/22/2023,2025-04-04,african_food
https://www.thespruceeats.com/mille-feuille-homemade-napoleon-recipe-2394442,Mille-Feuille (French Napoleon Dessert),pounds puff pastry; cups pastry cream; cup heavy cream; tablespoons all-purpose flour; grams) bittersweet chocolate; large egg whites; teaspoons lemon juice; grams) confectioners' sugar,2 hr 48 min,Calories: 828; Fat: 41g; Carb: 104g; Protein: 12g,8/4/2024,2025-04-04,african_food
https://www.thespruceeats.com/grilled-lamn-chops-garlic-mint-spices-2394673,"Moroccan Grilled Lamb Chops With Garlic, Mint and Spices Recipe",kilogram lamb chops; cup fresh spearmint leaves; cup fresh cilantro; to 3 cloves garlic; tablespoons lemon juice; tablespoons olive oil; tablespoon ground cumin; teaspoons paprika; teaspoons salt; teaspoon ground ginger; teaspoon ground turmeric; teaspoon ground black pepper; teaspoon cayenne,30 min,Calories: 838; Fat: 60g; Carb: 3g; Protein: 72g,6/16/2022,2025-04-04,african_food
https://www.thespruceeats.com/batbout-recipe-mkhamer-toghrift-matlou-2394366,Moroccan Pita Bread (Batbout) Recipe,tablespoon yeast; cups all-purpose flour; cups semolina or durum flour; cup whole wheat flour; tablespoons sugar; teaspoons kosher salt; tablespoons vegetable or olive oil; cups warm water,2 hr 50 min,Calories: 173; Fat: 3g; Carb: 32g; Protein: 5g,9/26/2021,2025-04-04,african_food
https://www.thespruceeats.com/msemen-moroccan-pancakes-rghaif-2394812,Msemen Dough for Square-Shaped Moroccan Pancakes,grams all-purpose flour; grams fine semolina; teaspoons granulated sugar; teaspoons kosher salt; teaspoon yeast; cups water; cups vegetable oil; cup fine semolina; cup unsalted butter; salted butter; honey; or jam,70 min,Calories: 5560; Fat: 379g; Carb: 471g; Protein: 68g,7/13/2021,2025-04-04,african_food
https://www.thespruceeats.com/moroccan-chicken-briouat-recipe-2394894,Moroccan Chicken Briouat Recipe,whole chicken; large onions; tablespoon ground ginger; teaspoon ground white pepper; teaspoon freshly ground black pepper; or 2  small pieces cinnamon stick; teaspoon saffron threads; teaspoon ground turmeric; to 2 teaspoons salt; cup vegetable oil; cup olive oil; cup fresh cilantro; pound phyllo dough; tablespoons butter; large egg yolk; vegetable oil,100 min,Calories: 1478; Fat: 108g; Carb: 69g; Protein: 58g,6/28/2021,2025-04-04,african_food
https://www.thespruceeats.com/tagine-with-carrots-potatoes-chickpeas-2394339,"Moroccan Tagine With Carrots, Potatoes, and Chickpeas Recipe",to 1 1/2 pounds beef; medium onions; cloves garlic; cup chopped cilantro; cup chopped parsley; teaspoons ground ginger; teaspoon salt; teaspoon turmeric; teaspoon freshly ground black pepper; teaspoon ground cinnamon; pinch saffron threads; cayenne pepper to taste; to 1/2 cup olive oil; pound carrots; pound potatoes; cups chickpeas; cup green olives; preserved lemon,95 min,Calories: 715; Fat: 42g; Carb: 50g; Protein: 38g,6/21/2021,2025-04-04,african_food
https://www.thespruceeats.com/moroccan-roast-chicken-with-preserved-lemons-2394656,Moroccan Roasted Chicken With Preserved Lemons,whole chicken; teaspoon salt; teaspoon ground black pepper; teaspoon ginger; teaspoon turmeric; teaspoon saffron threads; small clove garlic; tablespoon fresh cilantro; tablespoon olive oil; tablespoon lemon juice; large white onions; cloves garlic; teaspoon ginger; teaspoon ground black pepper; teaspoon ground white pepper; teaspoon salt; teaspoon turmeric; tablespoons fresh cilantro; stick cinnamon stick; teaspoon smen; to 4 tablespoons vegetable oil; teaspoon saffron threads; preserved lemon; handful green olives,3 hr 20 min,Calories: 615; Fat: 42g; Carb: 10g; Protein: 47g,2/4/2022,2025-04-04,african_food
https://www.thespruceeats.com/moroccan-meloui-pancake-rghaif-2394809,Moroccan Meloui Recipe - Round Moroccan Pancake (Rghaif),cups all-purpose flour; cups semolina; teaspoons sugar; teaspoons salt; teaspoon yeast; cups water; cup vegetable oil; cup unsalted butter; cup semolina,85 min,Calories: 264; Fat: 16g; Carb: 26g; Protein: 4g,2/2/2022,2025-04-04,african_food
https://www.thespruceeats.com/mallow-salad-with-lemon-and-olives-2394874,Moroccan Mallow Salad Recipe,(250 grams mallow leaves; cup olive oil; cup fresh parsley; cloves garlic; teaspoons paprika; teaspoons cumin; teaspoons salt; teaspoon cayenne pepper; to 2 tablespoons lemon juice; preserved lemon rind; preserved lemon pulp; handful red olives,40 min,Calories: 282; Fat: 29g; Carb: 7g; Protein: 1g,3/1/2022,2025-04-04,african_food
https://www.thespruceeats.com/baked-fish-tagine-with-potatoes-vegetables-2394734,"Moroccan Baked Fish Tagine With Potatoes, Carrots, Tomatoes and Peppers Recipe",pounds sea bass; large carrots; large potatoes; to 4 tomatoes; green peppers; to 2 chili peppers; to 2 lemons; salt; ginger; freshly ground black pepper; ounces red olives; tablespoons chopped parsley; large bunch cilantro; cloves garlic; tablespoons paprika; tablespoon cumin; teaspoon salt; teaspoon ginger; teaspoon cayenne pepper; teaspoon saffron threads; tablespoons vegetable oil; tablespoons lemon juice,90 min,Calories: 300; Fat: 10g; Carb: 51g; Protein: 10g,8/28/2022,2025-04-04,african_food
https://www.thespruceeats.com/soursop-juice-and-smoothie-recipe-2078388,Soursop Juice & Smoothie,package soursop; cup diced fresh pineapple; cups diced fresh\u200b coconut; large kale; -inch piece fresh ginger; peeled; cup water,5 min,Calories: 552; Fat: 29g; Carb: 77g; Protein: 10g,3/16/2023,2025-04-04,african_food
https://www.thespruceeats.com/chermoula-recipe-moroccan-marinade-2394640,Moroccan Chermoula Marinade,large bunch cilantro; cloves garlic; tablespoons paprika; tablespoon cumin; teaspoon salt; teaspoon fresh ginger; teaspoon cayenne pepper; teaspoon saffron threads; tablespoons vegetable oil; tablespoons lemon juice,10 min,Calories: 45; Fat: 4g; Carb: 2g; Protein: 0g,8/25/2021,2025-04-04,african_food
https://www.thespruceeats.com/chicken-rfissa-trid-with-lentils-enugreek-2394655,"Moroccan Chicken Rfissa - Trid Pastry With Chicken, Lentils, and Fenugreek",chicken; to 3 large onions; cup olive oil; teaspoons salt; teaspoons ground black pepper; tablespoon ground ginger; teaspoons ras el hanout; teaspoon turmeric; teaspoon saffron threads; cup lentils; tablespoons fenugreek seeds; teaspoon saffron threads; small bunch cilantro; small bunch parsley; cups water; teaspoon smen; to 1 1/2 batches msemen,3 hr 30 min,Calories: 802; Fat: 42g; Carb: 60g; Protein: 46g,2/23/2022,2025-04-04,african_food
https://www.thespruceeats.com/moroccan-potato-cakes-maakouda-batata-2394879,Maakouda Batata: Moroccan Potato Cakes,pounds potatoes; teaspoons salt; tablespoons butter; small onion; cloves garlic; tablespoons ground cumin; teaspoon ground black pepper; teaspoon turmeric; cup chopped cilantro; large eggs; olive oil,2 hr 50 min,Calories: 426; Fat: 30g; Carb: 35g; Protein: 7g,2/12/2023,2025-04-04,african_food
https://www.thespruceeats.com/how-to-make-barley-couscous-couscous-belboula-4775109,Couscous Belboula (Barley Couscous) Recipe,pounds dry barley couscous; cup vegetable oil; cups water; tablespoons salt; tablespoons unsalted butter; cup chicken broth,80 min,Calories: 75; Fat: 2g; Carb: 12g; Protein: 2g,6/7/2022,2025-04-04,african_food
https://www.thespruceeats.com/candied-peanuts-caramelized-peanuts-2394477,Caramelized Candied Peanuts,cups raw peanuts; cup granulated sugar; cup water; to 2 pinches coarse salt; splash  orange flower water,25 min,Calories: 304; Fat: 18g; Carb: 31g; Protein: 9g,12/24/2022,2025-04-04,african_food
https://www.thespruceeats.com/classic-moroccan-lamb-beef-kebabs-brochettes-2394649,Classic Moroccan Lamb or Beef Kebabs (Brochettes),pounds beef filet; large onion; tablespoons fresh parsley; tablespoons fresh cilantro; tablespoon vegetable oil; tablespoon lemon juice; teaspoons paprika; teaspoons salt; teaspoon ground cumin; teaspoon ground black pepper,2 hr 40 min,Calories: 540; Fat: 35g; Carb: 3g; Protein: 51g,12/29/2022,2025-04-04,african_food
https://www.thespruceeats.com/moroccan-beghrir-spongy-semolina-honeycomb-pancakes-2394804,Moroccan Beghrir (Semolina Honeycomb Pancakes),cups fine semolina or durum flour; cup all-purpose flour; teaspoon kosher salt; teaspoon sugar; teaspoons; cups plus 2 tablespoons lukewarm water; tablespoon yeast; glasses lukewarm water; glass fine semolina; glass all-purpose flour; teaspoon kosher salt; teaspoon sugar; teaspoons baking powder; tablespoon yeast,80 min,Calories: 2192; Fat: 8g; Carb: 447g; Protein: 79g,7/11/2021,2025-04-04,african_food
https://www.thespruceeats.com/matboucha-moroccan-tomato-and-pepper-salad-2121737,Matbucha—Moroccan Tomato and Pepper Salad,medium tomatoes; to 6 cloves garlic; small jalapeño pepper; cup canola oil; tablespoons paprika; teaspoons kosher salt; to 1 teaspoon ground black pepper,45 min,Calories: 106; Fat: 9g; Carb: 6g; Protein: 1g,12/21/2021,2025-04-04,african_food
https://www.thespruceeats.com/moroccan-zaalouk-eggplant-and-tomato-salad-2394866,Moroccan Zaalouk (Cooked Eggplant and Tomato Salad),large eggplant; large tomatoes; cloves garlic; cup fresh cilantro; cup fresh parsley; tablespoon paprika; tablespoon cumin; teaspoons salt; cup extra-virgin olive oil; cup water; teaspoon cayenne pepper; lemon wedge; extra-virgin olive oil; loaf bread,65 min,Calories: 492; Fat: 15g; Carb: 78g; Protein: 14g,12/8/2024,2025-04-04,african_food
https://www.thespruceeats.com/easy-green-bean-saute-recipe-2394856,Easy Garlic Green Beans,pound fresh green beans; to 2 tablespoons butter; to 4 small cloves garlic; salt to taste; ground pepper to taste; tablespoons fresh parsley,22 min,Calories: 92; Fat: 6g; Carb: 9g; Protein: 2g,6/22/2022,2025-04-04,african_food
https://www.thespruceeats.com/moroccan-saffron-chicken-recipe-2394657,Moroccan Saffron Chicken,whole chicken; large white onions; tablespoon ground ginger; teaspoon white pepper; teaspoon black pepper; pieces cinnamon stick; teaspoon saffron; teaspoon turmeric; to 2 teaspoons salt; cup unsalted butter; cup olive oil; cup cilantro,75 min,Calories: 651; Fat: 48g; Carb: 6g; Protein: 47g,12/28/2022,2025-04-04,african_food
https://www.thespruceeats.com/fal-gnaoua-black-eyed-peas-cowpeas-2395039,Moroccan Black-Eyed Peas (Cowpeas) - Ful Gnaoua,grams dried\xa0black-eyed peas; medium tomatoes; large onion; cloves garlic; tablespoons fresh parsley; teaspoons salt; teaspoons ground cumin; to 2 teaspoons sweet paprika; teaspoon ground ginger; teaspoon cayenne pepper; cup olive oil,50 min,Calories: 383; Fat: 15g; Carb: 49g; Protein: 17g,3/1/2022,2025-04-04,african_food
https://www.thespruceeats.com/moroccan-vegetarian-carrot-and-chickpea-tagine-2395043,Moroccan Vegetarian Carrot and Chickpea Tagine,large onion; cloves garlic; tablespoons olive oil; teaspoons salt; teaspoon ginger; teaspoon turmeric; teaspoon ground cinnamon; teaspoon ground black pepper; teaspoon cayenne pepper; teaspoon ras el hanout; to 3 tablespoons fresh parsley; to 5 carrots; cup water; to 3 teaspoons honey; cups canned chickpeas; or 2 small chile\xa0peppers; cup golden raisins,55 min,Calories: 268; Fat: 13g; Carb: 34g; Protein: 7g,12/15/2021,2025-04-04,african_food
https://www.thespruceeats.com/moroccan-fried-cauliflower-recipe-2394842,Moroccan Fried Cauliflower,medium-sized head cauliflower; large eggs; cup water; cup all-purpose flour; to 3 cloves garlic; tablespoons fresh parsley; tablespoon cumin; teaspoons paprika; teaspoons salt; teaspoon cayenne pepper; teaspoon turmeric; vegetable oil; dipping sauce,40 min,Calories: 473; Fat: 41g; Carb: 22g; Protein: 7g,1/12/2022,2025-04-04,african_food
https://www.thespruceeats.com/suya-spice-recipe-5071303,Suya Spice,cup roasted peanuts; teaspoon cayenne pepper; teaspoon ground ginger; teaspoon garlic powder; chicken stock cube; pinch ground cloves; pinch allspice; salt,65 min,Calories: 885; Fat: 73g; Carb: 36g; Protein: 37g,2/17/2023,2025-04-04,african_food
https://www.thespruceeats.com/merguez-sausage-recipe-2394324,Moroccan Merguez Sausage,pound ground beef; cloves garlic; tablespoons cilantro; tablespoons merguez spice mix; to 3 teaspoons harissa; sausage casings,30 min,Calories: 248; Fat: 19g; Carb: 3g; Protein: 16g,12/21/2022,2025-04-04,african_food
https://www.thespruceeats.com/fish-tagine-mqualli-with-potatoes-tomatoes-2394681,Moroccan Fish Tagine (Mqualli),pounds firm fish; batch chermoula marinade; bell peppers; any color; cup olive oil; large onion; carrot; large potatoes; teaspoon ginger; teaspoon kosher salt; teaspoon freshly ground black pepper; teaspoon turmeric; pinch saffron threads; to 3 tomatoes; lemon; handful red olives,4 hr 30 min,Calories: 572; Fat: 26g; Carb: 47g; Protein: 46g,11/23/2021,2025-04-04,african_food
https://www.thespruceeats.com/kaab-el-ghazal-gazelle-horns-p2-2394485,Kaab el Ghazal - Gazelle Horns (Cornes de Gazelle),pound almonds; cups sugar; cup orange flower water; cup unsalted butter; teaspoon cinnamon; pinch mastic; cups all-purpose flour; teaspoon salt; large eggs; cup unsalted butter; to 5 tablespoons orange flower water; large egg; tablespoon orange flower water; orange flower water,2 hr 30 min,Calories: not found; Fat: not found; Carb: not found; Protein: not found,11/29/2021,2025-04-04,african_food
